{
  "$schema": "https://json-schema.org/draft/2020-12/schema",
  "$id": "https://internal.invalid/migration-skill-lab/work-item-handoff.schema.json",
  "title": "Migration Work Item Handoff",
  "type": "object",
  "additionalProperties": false,
  "required": [
    "schemaVersion",
    "artifactType",
    "handoffPhase",
    "skill",
    "skillVersion",
    "runId",
    "flowId",
    "primaryArtifact",
    "epic",
    "feature",
    "stories",
    "standup",
    "manualApplication",
    "evidence",
    "openQuestions"
  ],
  "properties": {
    "schemaVersion": { "const": 3 },
    "artifactType": { "const": "work-item-handoff" },
    "handoffPhase": {
      "type": "string",
      "enum": ["baseline", "migration", "verification"]
    },
    "skill": {
      "type": "string",
      "enum": ["flow-baseline", "migrate-flow", "verify-flow"]
    },
    "skillVersion": {
      "type": "string",
      "pattern": "^\\d+\\.\\d+\\.\\d+$"
    },
    "runId": {
      "type": "string",
      "pattern": "^[a-z0-9]+(?:-[a-z0-9]+)*$"
    },
    "flowId": {
      "type": "string",
      "pattern": "^[a-z0-9]+(?:-[a-z0-9]+)*$"
    },
    "primaryArtifact": {
      "type": "object",
      "additionalProperties": false,
      "required": ["artifactType", "path", "sha256"],
      "properties": {
        "artifactType": {
          "type": "string",
          "enum": [
            "flow-contract",
            "migration-result",
            "verification-result"
          ]
        },
        "path": { "type": "string", "minLength": 1 },
        "sha256": {
          "type": "string",
          "pattern": "^[a-f0-9]{64}$"
        }
      }
    },
    "previousHandoff": {
      "type": "object",
      "additionalProperties": false,
      "required": ["path", "sha256"],
      "properties": {
        "path": { "type": "string", "minLength": 1 },
        "sha256": {
          "type": "string",
          "pattern": "^[a-f0-9]{64}$"
        }
      }
    },
    "previousApplication": {
      "type": "object",
      "additionalProperties": false,
      "required": [
        "handoffSha256",
        "status",
        "recordedByRole",
        "recordedAt",
        "summary"
      ],
      "properties": {
        "handoffSha256": {
          "type": "string",
          "pattern": "^[a-f0-9]{64}$"
        },
        "status": {
          "type": "string",
          "enum": ["confirmed-applied", "not-applied"]
        },
        "recordedByRole": {
          "type": "string",
          "minLength": 1
        },
        "recordedAt": {
          "type": "string",
          "pattern": "^\\d{4}-\\d{2}-\\d{2}T\\d{2}:\\d{2}:\\d{2}(?:\\.\\d+)?Z$"
        },
        "summary": { "type": "string", "minLength": 1 },
        "createdExternalIds": {
          "type": "array",
          "uniqueItems": true,
          "items": {
            "type": "object",
            "additionalProperties": false,
            "required": ["localId", "externalId"],
            "properties": {
              "localId": { "type": "string", "minLength": 1 },
              "externalId": {
                "type": "string",
                "pattern": "^[0-9]+$"
              }
            }
          }
        }
      }
    },
    "epic": {
      "type": "object",
      "additionalProperties": false,
      "required": [
        "localId",
        "action",
        "title",
        "currentState",
        "currentProgress",
        "proposedState",
        "proposedProgress",
        "fields",
        "structureComment"
      ],
      "properties": {
        "localId": {
          "type": "string",
          "pattern": "^[a-z0-9]+(?:-[a-z0-9]+)*$"
        },
        "externalId": {
          "type": "string",
          "pattern": "^[0-9]+$"
        },
        "action": {
          "type": "string",
          "enum": ["create", "update", "no-change"]
        },
        "title": { "type": "string", "minLength": 1 },
        "currentState": { "type": "string", "minLength": 1 },
        "currentProgress": {
          "type": "integer",
          "minimum": 0,
          "maximum": 100
        },
        "proposedState": { "type": "string", "minLength": 1 },
        "proposedProgress": {
          "type": "integer",
          "minimum": 0,
          "maximum": 100
        },
        "fields": {
          "type": "object",
          "additionalProperties": false,
          "required": [
            "currentSituation",
            "desiredOutcome",
            "whyMatters",
            "successCriteria",
            "richReleaseNotes"
          ],
          "properties": {
            "currentSituation": { "type": "string", "minLength": 1 },
            "desiredOutcome": { "type": "string", "minLength": 1 },
            "whyMatters": { "type": "string", "minLength": 1 },
            "successCriteria": {
              "type": "array",
              "minItems": 1,
              "uniqueItems": true,
              "items": { "type": "string", "minLength": 1 }
            },
            "richReleaseNotes": { "type": "string", "minLength": 1 }
          }
        },
        "structureComment": {
          "type": "string",
          "minLength": 1
        }
      }
    },
    "feature": {
      "type": "object",
      "additionalProperties": false,
      "required": [
        "localId",
        "action",
        "parentEpicLocalId",
        "title",
        "currentState",
        "currentProgress",
        "proposedState",
        "proposedProgress",
        "fields"
      ],
      "properties": {
        "localId": {
          "type": "string",
          "pattern": "^[a-z0-9]+(?:-[a-z0-9]+)*$"
        },
        "externalId": {
          "type": "string",
          "pattern": "^[0-9]+$"
        },
        "action": {
          "type": "string",
          "enum": ["create", "update", "no-change"]
        },
        "parentEpicExternalId": {
          "type": "string",
          "pattern": "^[0-9]+$"
        },
        "parentEpicLocalId": {
          "type": "string",
          "pattern": "^[a-z0-9]+(?:-[a-z0-9]+)*$"
        },
        "title": { "type": "string", "minLength": 1 },
        "currentState": { "type": "string", "minLength": 1 },
        "currentProgress": {
          "type": "integer",
          "minimum": 0,
          "maximum": 100
        },
        "proposedState": { "type": "string", "minLength": 1 },
        "proposedProgress": {
          "type": "integer",
          "minimum": 0,
          "maximum": 100
        },
        "fields": {
          "type": "object",
          "additionalProperties": false,
          "required": [
            "currentSituation",
            "desiredOutcome",
            "whyMatters",
            "successCriteria",
            "richReleaseNotes"
          ],
          "properties": {
            "currentSituation": { "type": "string", "minLength": 1 },
            "desiredOutcome": { "type": "string", "minLength": 1 },
            "whyMatters": { "type": "string", "minLength": 1 },
            "successCriteria": {
              "type": "array",
              "minItems": 1,
              "uniqueItems": true,
              "items": { "type": "string", "minLength": 1 }
            },
            "richReleaseNotes": { "type": "string", "minLength": 1 }
          }
        }
      }
    },
    "stories": {
      "type": "array",
      "minItems": 1,
      "items": {
        "type": "object",
        "additionalProperties": false,
        "required": [
          "localId",
          "action",
          "parentFeatureLocalId",
          "title",
          "currentState",
          "currentProgress",
          "proposedState",
          "proposedProgress",
          "fields",
          "tasks"
        ],
        "properties": {
          "localId": {
            "type": "string",
            "pattern": "^[a-z0-9]+(?:-[a-z0-9]+)*$"
          },
          "externalId": {
            "type": "string",
            "pattern": "^[0-9]+$"
          },
          "action": {
            "type": "string",
            "enum": ["create", "update", "no-change"]
          },
          "parentFeatureExternalId": {
            "type": "string",
            "pattern": "^[0-9]+$"
          },
          "parentFeatureLocalId": {
            "type": "string",
            "pattern": "^[a-z0-9]+(?:-[a-z0-9]+)*$"
          },
          "title": { "type": "string", "minLength": 1 },
          "currentState": { "type": "string", "minLength": 1 },
          "currentProgress": {
            "type": "integer",
            "minimum": 0,
            "maximum": 100
          },
          "proposedState": { "type": "string", "minLength": 1 },
          "proposedProgress": {
            "type": "integer",
            "minimum": 0,
            "maximum": 100
          },
          "fields": {
            "type": "object",
            "additionalProperties": false,
            "required": [
              "userValue",
              "currentBehavior",
              "desiredBehavior",
              "acceptanceCriteria",
              "attentionPoints",
              "attachmentInformation",
              "richReleaseNotes"
            ],
            "properties": {
              "userValue": { "type": "string", "minLength": 1 },
              "currentBehavior": { "type": "string", "minLength": 1 },
              "desiredBehavior": { "type": "string", "minLength": 1 },
              "acceptanceCriteria": {
                "type": "array",
                "minItems": 1,
                "uniqueItems": true,
                "items": { "type": "string", "minLength": 1 }
              },
              "attentionPoints": {
                "type": "array",
                "uniqueItems": true,
                "items": { "type": "string", "minLength": 1 }
              },
              "attachmentInformation": {
                "type": "string",
                "minLength": 1
              },
              "richReleaseNotes": { "type": "string", "minLength": 1 }
            }
          },
          "tasks": {
            "type": "array",
            "minItems": 1,
            "items": {
              "type": "object",
              "additionalProperties": false,
              "required": [
                "localId",
                "kind",
                "action",
                "parentStoryLocalId",
                "title",
                "description",
                "doneWhen",
                "ownerRole",
                "contributionPercent",
                "currentState",
                "currentProgress",
                "proposedState",
                "proposedProgress",
                "checkpointMilestones",
                "evidence",
                "blockers"
              ],
              "properties": {
                "localId": {
                  "type": "string",
                  "pattern": "^[a-z0-9]+(?:-[a-z0-9]+)*$"
                },
                "kind": {
                  "type": "string",
                  "enum": ["baseline", "implementation", "verification"]
                },
                "externalId": {
                  "type": "string",
                  "pattern": "^[0-9]+$"
                },
                "action": {
                  "type": "string",
                  "enum": ["create", "update", "no-change"]
                },
                "parentStoryLocalId": {
                  "type": "string",
                  "pattern": "^[a-z0-9]+(?:-[a-z0-9]+)*$"
                },
                "parentStoryExternalId": {
                  "type": "string",
                  "pattern": "^[0-9]+$"
                },
                "title": { "type": "string", "minLength": 1 },
                "description": { "type": "string", "minLength": 1 },
                "doneWhen": {
                  "type": "array",
                  "minItems": 1,
                  "uniqueItems": true,
                  "items": { "type": "string", "minLength": 1 }
                },
                "ownerRole": { "type": "string", "minLength": 1 },
                "contributionPercent": {
                  "type": "integer",
                  "minimum": 1,
                  "maximum": 100
                },
                "currentState": { "type": "string", "minLength": 1 },
                "currentProgress": {
                  "type": "integer",
                  "minimum": 0,
                  "maximum": 100
                },
                "proposedState": { "type": "string", "minLength": 1 },
                "proposedProgress": {
                  "type": "integer",
                  "minimum": 0,
                  "maximum": 100
                },
                "checkpointMilestones": {
                  "type": "array",
                  "uniqueItems": true,
                  "items": {
                    "type": "string",
                    "pattern": "^[a-z0-9]+(?:-[a-z0-9]+)*$"
                  }
                },
                "evidence": {
                  "type": "array",
                  "minItems": 1,
                  "uniqueItems": true,
                  "items": { "type": "string", "minLength": 1 }
                },
                "blockers": {
                  "type": "array",
                  "uniqueItems": true,
                  "items": { "type": "string", "minLength": 1 }
                }
              }
            }
          }
        }
      }
    },
    "standup": {
      "type": "object",
      "additionalProperties": false,
      "required": [
        "date",
        "storyLocalId",
        "storyExternalId",
        "currentBoardProgress",
        "proposedBoardProgress",
        "completedSincePreviousUpdate",
        "next",
        "blockers",
        "summary"
      ],
      "properties": {
        "date": {
          "type": "string",
          "pattern": "^\\d{4}-\\d{2}-\\d{2}$"
        },
        "storyLocalId": {
          "type": "string",
          "pattern": "^[a-z0-9]+(?:-[a-z0-9]+)*$"
        },
        "storyExternalId": {
          "type": "string",
          "pattern": "^[0-9]+$"
        },
        "currentBoardProgress": {
          "type": "integer",
          "minimum": 0,
          "maximum": 100
        },
        "proposedBoardProgress": {
          "type": "integer",
          "minimum": 0,
          "maximum": 100
        },
        "completedSincePreviousUpdate": {
          "type": "array",
          "minItems": 1,
          "uniqueItems": true,
          "items": { "type": "string", "minLength": 1 }
        },
        "next": {
          "type": "array",
          "minItems": 1,
          "uniqueItems": true,
          "items": { "type": "string", "minLength": 1 }
        },
        "blockers": {
          "type": "array",
          "uniqueItems": true,
          "items": { "type": "string", "minLength": 1 }
        },
        "summary": { "type": "string", "minLength": 1 }
      }
    },
    "manualApplication": {
      "type": "object",
      "additionalProperties": false,
      "required": ["status", "summary"],
      "properties": {
        "status": {
          "type": "string",
          "enum": ["copy-ready", "confirmed-applied", "not-applied"]
        },
        "confirmedByRole": {
          "type": "string",
          "minLength": 1
        },
        "confirmedAt": {
          "type": "string",
          "pattern": "^\\d{4}-\\d{2}-\\d{2}T\\d{2}:\\d{2}:\\d{2}(?:\\.\\d+)?Z$"
        },
        "summary": { "type": "string", "minLength": 1 }
      }
    },
    "evidence": {
      "type": "array",
      "minItems": 1,
      "uniqueItems": true,
      "items": { "type": "string", "minLength": 1 }
    },
    "openQuestions": {
      "type": "array",
      "uniqueItems": true,
      "items": { "type": "string", "minLength": 1 }
    }
  }
}
