{
  "schemaVersion": 3,
  "artifactType": "work-item-handoff",
  "handoffPhase": "baseline",
  "skill": "flow-baseline",
  "skillVersion": "0.5.0",
  "runId": "demo-line-drawer-baseline-001",
  "flowId": "demo-line-drawer",
  "primaryArtifact": {
    "artifactType": "flow-contract",
    "path": "examples\\handoff\\demo-line-drawer\\flow-contract.json",
    "sha256": "f3e564f84c4667b750d05137a210ac522f8c18871237788b9061cbe5a1fe3d8b"
  },
  "epic": {
    "localId": "react-angular-migration",
    "externalId": "522482",
    "action": "update",
    "title": "Migration from React to Angular using AI (internship)",
    "currentState": "Open",
    "currentProgress": 0,
    "proposedState": "Open",
    "proposedProgress": 0,
    "fields": {
      "currentSituation": "The frontend is implemented in React and the migration work needs a reviewable hierarchy and evidence-driven delivery flow.",
      "desiredOutcome": "Migrate bounded frontend features to Angular with reusable AI-assisted analysis, implementation and verification evidence.",
      "whyMatters": "The internship must prove a safe migration approach while keeping stakeholders informed about scope, progress and risk.",
      "successCriteria": [
        "Each Feature and User Story has a clear bounded outcome.",
        "Progress is derived from completed stakeholder-visible Tasks.",
        "Verified migration evidence supports the decision for each next slice."
      ],
      "richReleaseNotes": "Epic hierarchy and first bounded migration workflow prepared."
    },
    "structureComment": "EPIC - Migrate frontend from React to Angular\n|\n+-- Feature - Map Making\n    |\n    +-- User Story - Detail drawer\n    +-- User Story - Right side drawer / toolbox\n    +-- User Story - Line drawing\n    +-- User Story - Add objects\n    +-- User Story - Lidar image overlay"
  },
  "feature": {
    "localId": "map-making-page",
    "externalId": "522511",
    "action": "update",
    "parentEpicLocalId": "react-angular-migration",
    "parentEpicExternalId": "522482",
    "title": "Migrate Map Making Page",
    "currentState": "In Progress",
    "currentProgress": 0,
    "proposedState": "In Progress",
    "proposedProgress": 0,
    "fields": {
      "currentSituation": "The map-making experience is implemented in React and direct drawlib integrations.",
      "desiredOutcome": "Migrate bounded map-making slices to Angular while preserving observable behavior.",
      "whyMatters": "A bounded migration reduces integration risk and produces reusable migration evidence.",
      "successCriteria": [
        "The approved Detail Drawer slice preserves its agreed scenarios.",
        "React retains application and canvas ownership during the POC."
      ],
      "richReleaseNotes": "Baseline prepared for the first bounded Angular migration slice."
    }
  },
  "stories": [
    {
      "localId": "migrate-detail-drawer",
      "externalId": "522512",
      "action": "update",
      "parentFeatureLocalId": "map-making-page",
      "parentFeatureExternalId": "522511",
      "title": "Migrate Detail Drawer",
      "currentState": "In development",
      "currentProgress": 0,
      "proposedState": "In development",
      "proposedProgress": 20,
      "fields": {
        "userValue": "As a map editor, I want to edit a selected line in an Angular drawer so that the map updates without losing existing behavior.",
        "currentBehavior": "React owns the drawer and updates the selected drawlib line.",
        "desiredBehavior": "Angular owns only the drawer and communicates through typed inputs, commands and events.",
        "acceptanceCriteria": [
          "The drawer shows the selected line identifier, length and angle.",
          "Valid edits update the SVG and preserve undo and redo.",
          "Invalid edits show the agreed visible validation outcome.",
          "Closing and reopening does not retain stale state or duplicate listeners."
        ],
        "attentionPoints": [
          "Validate one representative scenario in the required host environment.",
          "Do not expand ownership to routing, Auth0, Maui or the canvas container."
        ],
        "attachmentInformation": "Attach the approved baseline report and Flow Contract references; do not attach source copies.",
        "richReleaseNotes": "Behavior baseline and acceptance criteria prepared; implementation has not started."
      },
      "tasks": [
        {
          "localId": "detail-drawer-baseline",
          "kind": "baseline",
          "action": "create",
          "parentStoryLocalId": "migrate-detail-drawer",
          "parentStoryExternalId": "522512",
          "title": "Establish Detail Drawer behavior baseline",
          "description": "Document current behavior, acceptance scenarios, evidence gaps, scope and approval requirements.",
          "doneWhen": [
            "The baseline report and draft Flow Contract validate.",
            "Acceptance scenarios and open decisions are visible."
          ],
          "ownerRole": "Engineer",
          "contributionPercent": 20,
          "currentState": "Not created",
          "currentProgress": 0,
          "proposedState": "Done",
          "proposedProgress": 100,
          "checkpointMilestones": [],
          "evidence": [
            "Validated baseline report and draft Flow Contract."
          ],
          "blockers": []
        },
        {
          "localId": "detail-drawer-implementation",
          "kind": "implementation",
          "action": "create",
          "parentStoryLocalId": "migrate-detail-drawer",
          "parentStoryExternalId": "522512",
          "title": "Implement the bounded Angular Detail Drawer",
          "description": "Add missing React characterization evidence and implement the approved Angular slice with scoped checkpoints.",
          "doneWhen": [
            "Required React behavior evidence passes.",
            "The Angular slice and matching tests pass.",
            "Every product checkpoint is allowlisted and verified."
          ],
          "ownerRole": "Engineer",
          "contributionPercent": 55,
          "currentState": "Not created",
          "currentProgress": 0,
          "proposedState": "To Do",
          "proposedProgress": 0,
          "checkpointMilestones": [
            "react-characterization",
            "angular-drawer"
          ],
          "evidence": [
            "Implementation has not started."
          ],
          "blockers": [
            "Flow Contract and Angular conventions require approval."
          ]
        },
        {
          "localId": "detail-drawer-verification",
          "kind": "verification",
          "action": "create",
          "parentStoryLocalId": "migrate-detail-drawer",
          "parentStoryExternalId": "522512",
          "title": "Verify the Detail Drawer migration",
          "description": "Independently verify all contract scenarios and the required host scenario before proposing Done.",
          "doneWhen": [
            "Every contract scenario passes independently.",
            "The required host validation passes.",
            "The verified branch push outcome is recorded."
          ],
          "ownerRole": "Engineer and host tester",
          "contributionPercent": 25,
          "currentState": "Not created",
          "currentProgress": 0,
          "proposedState": "To Do",
          "proposedProgress": 0,
          "checkpointMilestones": [],
          "evidence": [
            "Verification has not started."
          ],
          "blockers": [
            "A host validation owner and environment must be assigned."
          ]
        }
      ]
    }
  ],
  "standup": {
    "date": "2026-09-07",
    "storyLocalId": "migrate-detail-drawer",
    "storyExternalId": "522512",
    "currentBoardProgress": 0,
    "proposedBoardProgress": 20,
    "completedSincePreviousUpdate": [
      "Prepared and validated the Detail Drawer behavior baseline and draft Flow Contract."
    ],
    "next": [
      "Review the open product and Angular decisions before implementation approval."
    ],
    "blockers": [
      "Invalid-input behavior, Angular conventions and host validation ownership are not approved."
    ],
    "summary": "Detail Drawer is at 20%: the baseline is complete. Next is contract approval; implementation is blocked by the open product, Angular and host decisions."
  },
  "manualApplication": {
    "status": "copy-ready",
    "summary": "Copy the proposed Epic, Feature, User Story, Tasks and standup update into Targetprocess and confirm what was applied."
  },
  "evidence": [
    "Sanitized example Flow Contract scenarios.",
    "Canonical selected-line Detail Drawer POC boundary."
  ],
  "openQuestions": []
}
