{
  "schemaVersion": 3,
  "artifactType": "work-item-handoff",
  "handoffPhase": "migration",
  "skill": "migrate-flow",
  "skillVersion": "0.5.0",
  "runId": "demo-line-drawer-migration-001",
  "flowId": "demo-line-drawer",
  "primaryArtifact": {
    "artifactType": "migration-result",
    "path": "examples\\handoff\\demo-line-drawer\\migration-result.json",
    "sha256": "034608f1abb5e61ededdfd60758683af48b89630150d6fb726d2bfb5cdf66144"
  },
  "previousHandoff": {
    "path": "examples\\handoff\\demo-line-drawer\\work-item-baseline.json",
    "sha256": "6e384fdf4a3e845decd6e9bda05daec2035e3e5d86d0fb5988c2c853c0c48dcf"
  },
  "previousApplication": {
    "handoffSha256": "6e384fdf4a3e845decd6e9bda05daec2035e3e5d86d0fb5988c2c853c0c48dcf",
    "status": "confirmed-applied",
    "recordedByRole": "implementer",
    "recordedAt": "2026-09-07T08:00:00Z",
    "summary": "The baseline Feature and User Story content was applied manually."
  },
  "epic": {
    "localId": "react-angular-migration",
    "externalId": "522482",
    "action": "update",
    "title": "Migration from React to Angular using AI (internship)",
    "currentState": "Open",
    "currentProgress": 0,
    "proposedState": "Open",
    "proposedProgress": 5,
    "fields": {
      "currentSituation": "The first bounded Angular slice is implemented locally with validated checkpoint evidence.",
      "desiredOutcome": "Complete independent verification before using the POC as evidence for the wider migration.",
      "whyMatters": "Verified bounded delivery demonstrates whether the migration method is safe and reusable.",
      "successCriteria": [
        "The Detail Drawer POC passes independent verification.",
        "The team reviews the evidence before selecting another slice."
      ],
      "richReleaseNotes": "First bounded implementation completed locally; verification remains."
    },
    "structureComment": "EPIC - Migrate frontend from React to Angular\n|\n+-- Feature - Map Making\n    |\n    +-- User Story - Detail drawer\n    +-- User Story - Right side drawer / toolbox\n    +-- User Story - Line drawing\n    +-- User Story - Add objects\n    +-- User Story - Lidar image overlay"
  },
  "feature": {
    "localId": "map-making-page",
    "externalId": "522511",
    "action": "update",
    "parentEpicLocalId": "react-angular-migration",
    "parentEpicExternalId": "522482",
    "title": "Migrate Map Making Page",
    "currentState": "In Progress",
    "currentProgress": 0,
    "proposedState": "In Progress",
    "proposedProgress": 35,
    "fields": {
      "currentSituation": "The first bounded Angular slice is implemented behind the approved React boundary.",
      "desiredOutcome": "Complete independent verification before treating the Detail Drawer slice as done.",
      "whyMatters": "Checkpointed implementation evidence preserves progress without overstating completion.",
      "successCriteria": [
        "The Detail Drawer implementation passes its targeted checks.",
        "Independent verification and host validation still complete the exit gate."
      ],
      "richReleaseNotes": "Detail Drawer implementation checkpoint created; independent verification remains."
    }
  },
  "stories": [
    {
      "localId": "migrate-detail-drawer",
      "externalId": "522512",
      "action": "update",
      "parentFeatureLocalId": "map-making-page",
      "parentFeatureExternalId": "522511",
      "title": "Migrate Detail Drawer",
      "currentState": "In development",
      "currentProgress": 20,
      "proposedState": "In development",
      "proposedProgress": 75,
      "fields": {
        "userValue": "As a map editor, I want to edit a selected line in an Angular drawer so that the map updates without losing existing behavior.",
        "currentBehavior": "The bounded Angular drawer implementation and targeted tests are present.",
        "desiredBehavior": "The same scenarios must pass independent verification and host validation.",
        "acceptanceCriteria": [
          "The drawer shows the selected line identifier, length and angle.",
          "Valid edits update the SVG and preserve undo and redo.",
          "Invalid edits show the agreed visible validation outcome.",
          "Closing and reopening does not retain stale state or duplicate listeners."
        ],
        "attentionPoints": [
          "The local checkpoint is not proof of independent verification.",
          "Push only after complete PASS and explicit confirmation."
        ],
        "attachmentInformation": "Reference the migration result and checkpoint SHA; do not attach source copies.",
        "richReleaseNotes": "Implementation completed locally and stored in a validated scoped checkpoint."
      },
      "tasks": [
        {
          "localId": "detail-drawer-baseline",
          "kind": "baseline",
          "externalId": "700001",
          "action": "update",
          "parentStoryLocalId": "migrate-detail-drawer",
          "parentStoryExternalId": "522512",
          "title": "Establish Detail Drawer behavior baseline",
          "description": "Document current behavior, acceptance scenarios, evidence gaps, scope and approval requirements.",
          "doneWhen": [
            "The baseline report and approved Flow Contract validate.",
            "Acceptance scenarios and decisions are visible."
          ],
          "ownerRole": "Engineer",
          "contributionPercent": 20,
          "currentState": "Done",
          "currentProgress": 100,
          "proposedState": "Done",
          "proposedProgress": 100,
          "checkpointMilestones": [],
          "evidence": [
            "Approved Flow Contract validated."
          ],
          "blockers": []
        },
        {
          "localId": "detail-drawer-implementation",
          "kind": "implementation",
          "externalId": "700002",
          "action": "update",
          "parentStoryLocalId": "migrate-detail-drawer",
          "parentStoryExternalId": "522512",
          "title": "Implement the bounded Angular Detail Drawer",
          "description": "Add missing React characterization evidence and implement the approved Angular slice with scoped checkpoints.",
          "doneWhen": [
            "Required React behavior evidence passes.",
            "The Angular slice and matching tests pass.",
            "Every product checkpoint is allowlisted and verified."
          ],
          "ownerRole": "Engineer",
          "contributionPercent": 55,
          "currentState": "To Do",
          "currentProgress": 0,
          "proposedState": "Done",
          "proposedProgress": 100,
          "checkpointMilestones": [
            "react-characterization",
            "angular-drawer"
          ],
          "evidence": [
            "Scoped checkpoint abcdef1234567890abcdef1234567890abcdef12.",
            "Declared implementation validation passed."
          ],
          "blockers": []
        },
        {
          "localId": "detail-drawer-verification",
          "kind": "verification",
          "externalId": "700003",
          "action": "update",
          "parentStoryLocalId": "migrate-detail-drawer",
          "parentStoryExternalId": "522512",
          "title": "Verify the Detail Drawer migration",
          "description": "Independently verify all contract scenarios and the required host scenario before proposing Done.",
          "doneWhen": [
            "Every contract scenario passes independently.",
            "The required host validation passes.",
            "The verified branch push outcome is recorded."
          ],
          "ownerRole": "Engineer and host tester",
          "contributionPercent": 25,
          "currentState": "To Do",
          "currentProgress": 0,
          "proposedState": "To Do",
          "proposedProgress": 0,
          "checkpointMilestones": [],
          "evidence": [
            "Verification has not started."
          ],
          "blockers": []
        }
      ]
    }
  ],
  "standup": {
    "date": "2026-09-07",
    "storyLocalId": "migrate-detail-drawer",
    "storyExternalId": "522512",
    "currentBoardProgress": 20,
    "proposedBoardProgress": 75,
    "completedSincePreviousUpdate": [
      "Completed the bounded Angular implementation and stored it in a verified scoped checkpoint."
    ],
    "next": [
      "Run independent scenario and host verification."
    ],
    "blockers": [],
    "summary": "Detail Drawer is at 75%: baseline and implementation are complete. Next is independent and host verification."
  },
  "manualApplication": {
    "status": "copy-ready",
    "summary": "Copy the factual Epic-to-Task implementation progress and standup update into Targetprocess and confirm what was applied."
  },
  "evidence": [
    "Targeted drawer test passed.",
    "Scoped checkpoint abcdef1234567890abcdef1234567890abcdef12."
  ],
  "openQuestions": []
}
